type,title,created_utc,body,num_comments,url,keyword_matched,parent_post_title
post,London’s low-traffic zones ‘cut deaths and injuries by more than a third’,2025-07-07 15:32:20,,92.0,https://www.reddit.com/r/london/r/london/comments/1ltu9hf/londons_lowtraffic_zones_cut_deaths_and_injuries/,low traffic neighbourhood,
comment,,2025-07-07 15:52:24,"Most of us won't be surprised, but with how much protest there is against them, it is important there's now quantified published scientific research showing exactly how many deaths and injuries they prevent.",,https://www.reddit.com/r/london/r/london/comments/1ltu9hf/londons_lowtraffic_zones_cut_deaths_and_injuries/n1t2z83/,,London’s low-traffic zones ‘cut deaths and injuries by more than a third’
comment,,2025-07-07 17:17:51,"&gt;it is important there's now quantified published scientific research showing exactly how many deaths and injuries they prevent.


Because that'll teach the nutters!",,https://www.reddit.com/r/london/r/london/comments/1ltu9hf/londons_lowtraffic_zones_cut_deaths_and_injuries/n1tjz2f/,,London’s low-traffic zones ‘cut deaths and injuries by more than a third’
post,Low-Traffic Neighborhoods Are Reclaiming London's Streets From Cars,2024-06-13 09:29:34,,139.0,https://www.reddit.com/r/london/r/london/comments/1det7u2/lowtraffic_neighborhoods_are_reclaiming_londons/,low traffic neighbourhood,
comment,,2024-06-13 09:35:48,"What a great reason to be cheerful

Let's start to LTN Soho and Mayfair",,https://www.reddit.com/r/london/r/london/comments/1det7u2/lowtraffic_neighborhoods_are_reclaiming_londons/l8e6y4z/,,Low-Traffic Neighborhoods Are Reclaiming London's Streets From Cars
comment,,2024-06-13 13:10:45,Isn't the whole of Chinatown the equivalent of an LTN?,,https://www.reddit.com/r/london/r/london/comments/1det7u2/lowtraffic_neighborhoods_are_reclaiming_londons/l8eq899/,,Low-Traffic Neighborhoods Are Reclaiming London's Streets From Cars
comment,,2024-06-13 10:01:39,"Good. If you make the choice to drive your car you need to be prepared to stay on the main roads. Residential streets should not be plagued by these rat runners churning out their air pollution, noise and putting residents at risk in their own streets.",,https://www.reddit.com/r/london/r/london/comments/1det7u2/lowtraffic_neighborhoods_are_reclaiming_londons/l8e937w/,,Low-Traffic Neighborhoods Are Reclaiming London's Streets From Cars
comment,,2024-06-13 11:42:22,"I was so happy when one was rolled out in Lewisham. It stopped the local residential streets being solid with rat running traffic at rush hour. My favourite incident was a guy who legitimately jumped out his car and wanted to fight me because I crossed the road in front of him, preventing him shuffling 2 meters forwards into standing traffic.",,https://www.reddit.com/r/london/r/london/comments/1det7u2/lowtraffic_neighborhoods_are_reclaiming_londons/l8ehrkj/,,Low-Traffic Neighborhoods Are Reclaiming London's Streets From Cars
comment,,2024-06-13 12:49:49,"Yeah, we had one introduced where we used to live. Like you there were literally people jumping out of their cars and squaring up to one another about who had right of way. Some of them would literally drive at pedestrians who had the temerity to try and cross the street. 

It was a godsend and good riddance to the ratrunners. They wouldn’t do it in their own street so why do they think they can do it in someone else’s.",,https://www.reddit.com/r/london/r/london/comments/1det7u2/lowtraffic_neighborhoods_are_reclaiming_londons/l8eo0ps/,,Low-Traffic Neighborhoods Are Reclaiming London's Streets From Cars
post,West Dulwich low-traffic scheme opponents celebrate shock High Court victory,2025-05-09 14:54:37,,46.0,https://www.reddit.com/r/london/r/london/comments/1kihry7/west_dulwich_lowtraffic_scheme_opponents/,low traffic neighbourhood,
comment,,2025-05-09 17:42:00,"The BBC article has a pic of a bigger group of people associated with the campaign. Not a single person under 135. They got their housing, they got their final salary pensions, now they’re coming for your “minor improvements to active travel” infrastructure. The British boomer enjoys the best lifestyle in the UK, insists on a worse life for everyone, yet never seems to find any inner peace. Losers! If I had any power I would build huge skyscrapers around all their homes.",,https://www.reddit.com/r/london/r/london/comments/1kihry7/west_dulwich_lowtraffic_scheme_opponents/mrfpflt/,,West Dulwich low-traffic scheme opponents celebrate shock High Court victory
comment,,2025-05-10 07:31:46,"Yeah, but they vote.",,https://www.reddit.com/r/london/r/london/comments/1kihry7/west_dulwich_lowtraffic_scheme_opponents/mrjm7kt/,,West Dulwich low-traffic scheme opponents celebrate shock High Court victory
post,"Health gains of low-traffic schemes up to 100 times greater than costs, [London] study finds - The Guardian",2024-03-08 10:18:59,,43.0,https://www.reddit.com/r/london/r/london/comments/1b9k047/health_gains_of_lowtraffic_schemes_up_to_100/,low traffic neighbourhood,
comment,,2024-03-08 11:31:15,I agree LNS are good but it needs to be more business friendly.,,https://www.reddit.com/r/london/r/london/comments/1b9k047/health_gains_of_lowtraffic_schemes_up_to_100/ktwed2j/,,"Health gains of low-traffic schemes up to 100 times greater than costs, [London] study finds - The Guardian"
comment,,2024-03-08 12:39:55,What specifically do you mean by 'more business friendly'?,,https://www.reddit.com/r/london/r/london/comments/1b9k047/health_gains_of_lowtraffic_schemes_up_to_100/ktwipos/,,"Health gains of low-traffic schemes up to 100 times greater than costs, [London] study finds - The Guardian"
comment,,2024-03-08 13:37:15,Imagine being delivery driver and instead of driving 2min to next road you need to drive all way around. Also making route plan is way harder because sometimes your not sure if road have access.,,https://www.reddit.com/r/london/r/london/comments/1b9k047/health_gains_of_lowtraffic_schemes_up_to_100/ktwoqhe/,,"Health gains of low-traffic schemes up to 100 times greater than costs, [London] study finds - The Guardian"
comment,,2024-03-08 13:40:55,All roads have access. It’s not incumbent on local councils to prioritise delivery drivers’ satnavs over residents’ needs.,,https://www.reddit.com/r/london/r/london/comments/1b9k047/health_gains_of_lowtraffic_schemes_up_to_100/ktwp5tc/,,"Health gains of low-traffic schemes up to 100 times greater than costs, [London] study finds - The Guardian"
post,Tower Hamlets mayor accused of ‘culture war’ against low-traffic schemes,2023-02-14 14:54:04,,70.0,https://www.reddit.com/r/london/r/london/comments/1125wp1/tower_hamlets_mayor_accused_of_culture_war/,low traffic neighbourhood,
comment,,2023-02-14 15:50:51,"Just ask them if they're funded by anyone in Canary Wharf, London's finest 15 minute city.",,https://www.reddit.com/r/london/r/london/comments/1125wp1/tower_hamlets_mayor_accused_of_culture_war/j8ia1f9/,,Tower Hamlets mayor accused of ‘culture war’ against low-traffic schemes
post,Low traffic zones ‘force cars into streets where poorer people live’,2021-02-13 09:47:56,,83.0,https://www.reddit.com/r/london/r/london/comments/liwwtq/low_traffic_zones_force_cars_into_streets_where/,low traffic neighbourhood,
comment,,2021-02-13 10:47:51,Let's just call a spade a spade. Some roads are designed for more traffic. These schemes are designed to push traffic back onto those roads. There will always be some people who are unfortunately economically disadvantaged. We can attempt to redress that through other methods. But full equality in terms of exposure to traffic would require redesigning our cities from the bottom up. We don't have that luxury.,,https://www.reddit.com/r/london/r/london/comments/liwwtq/low_traffic_zones_force_cars_into_streets_where/gn6bo90/,,Low traffic zones ‘force cars into streets where poorer people live’
comment,,2021-02-13 10:57:30,"&gt; Some roads are designed for more traffic. These schemes are designed to push traffic back onto those roads. 

Yeah. Traffic has doubled on minor roads in London over the last ten years. A lot of this is due to satnav apps routing drivers down them to save a minute or two. Something had to be done.",,https://www.reddit.com/r/london/r/london/comments/liwwtq/low_traffic_zones_force_cars_into_streets_where/gn6dlvl/,,Low traffic zones ‘force cars into streets where poorer people live’
comment,,2021-02-13 11:50:12,"Yeah part of me feels we were better off when people had to use their A to Z and plan out a route that way. No-one would ever intentionally plan a squiggly route down unfamiliar back streets just to save a few minutes, but they will happily follow their phone that way.

I think sometimes the main road route will be slower, but more reliable. When you push a massive amount of traffic down tiny back streets in between cars, it doesn't take much to cause absolute mayhem. One broken down car, one accident, one person making an ill-advised three-point turn, suddenly it becomes very obvious that these streets aren't fit for the volumes of traffic they're being made to carry.",,https://www.reddit.com/r/london/r/london/comments/liwwtq/low_traffic_zones_force_cars_into_streets_where/gn6nynp/,,Low traffic zones ‘force cars into streets where poorer people live’
post,Why do we not see more of these used in London?,2024-03-28 13:05:57,"Most cars I see only have one or two people in them, and are stuck in traffic churning all sorts out of the exhaust. If you need to use a car, it seems like a great option. ",299.0,https://www.reddit.com/r/london/r/london/comments/1bpty31/why_do_we_not_see_more_of_these_used_in_london/,low traffic neighbourhood,
comment,,2024-03-28 14:24:28,"Does that mean you don’t need a full driving license for one? Never seen these before, sorry if it’s a stupid question!",,https://www.reddit.com/r/london/r/london/comments/1bpty31/why_do_we_not_see_more_of_these_used_in_london/kwy8tkt/,,Why do we not see more of these used in London?
comment,,2024-03-28 15:00:34,"Not read about them since they came out but yeah I remember you still need a moped or normal driving license so either way you have to do the theory and practical even though it only tops out at 28mph.I guess getting hit at 28mph by a 500kg object can still kill someone and you need to know all the rules so why not. I also remember them being quite expensive for what they are though, pretty sure they were like £9-10k.

They're a bit smaller than the small smart cars. Maybe a 30cm ruler length shorter and narrower. If Smart cars aren't taking off and they can be used on any roads and go the national speed limit then I don't think these things will.

They seem to be a bit of a weird inbetween car. Like if you need a full license and it's costing £10,000 then at least have it go 45mph or so because then it'll definitely be good for even outer london too at that speed. They can be had for cheap monthly, maybe thats the selling point.

Either way tiny cars aren't going to take off unless we tax cars based on size, and maybe set parking based on size like Paris recently did. Until then for some reason people will continue buying bigger and bigger cars even though a seat is a seat and almost nobody needs the extra cargo space. Have like 5 bands of car tax based on size and weight and have the biggest be around double the current rates and the smallest around half the current rates. Only then will people maybe think about getting smaller cars. Or ideally if supermarkets and other places started putting just a couple/few mini spaces near the entrances for cars like this then they'll take off like crazy imo. Would be awesome driving straight to the front to get an easy spot every time, plus the supermarket will fit more spaces, everyone wins including pedestrians, cyclists, and the environment.

Edit: Fullycharged just did a video on a budget alternative to this car, the video has them testing it in London. Only £6k but it's very stripped back and basic, same speed and license needed and stuff.

Just remembered they did a video on what actually is the perfect London car though. It's similar size to the OP car and is called the Silence S04 and is also good quality looking. Selling point is that it has 2 batteries that slide in under the seat which each slide out and has trolly wheels, they look just like a small suitcase. You then just wheel the small suitcase into your house and charge it there. So it even solves any charging issues that comes with having no off street parking. It also has a max speed of 55mph so it can hold up on any London road, no need to avoid 50-60mph roads like I would if I was using the 28mph max speed cars. It costs £15,000 though but honestly it's perfect and solves all the issues the oriignal post car has. Easily worth the extra £5k. Heres the video on it.

https://www.youtube.com/watch?v=q1LHh6FkpuI",,https://www.reddit.com/r/london/r/london/comments/1bpty31/why_do_we_not_see_more_of_these_used_in_london/kwyehc1/,,Why do we not see more of these used in London?
comment,,2024-03-28 18:44:55,I saw one the other day. It looked like when Mr Incredible is driving his car.,,https://www.reddit.com/r/london/r/london/comments/1bpty31/why_do_we_not_see_more_of_these_used_in_london/kwzil9r/,,Why do we not see more of these used in London?
post,"New low-traffic schemes in London halve number of road injuries, study shows",2021-07-23 11:45:23,,54.0,https://www.reddit.com/r/london/r/london/comments/opz2df/new_lowtraffic_schemes_in_london_halve_number_of/,low traffic neighbourhood,
comment,,2021-07-23 12:03:11,Yeah but HOW AM I MEANT TO DRIVE 209 YARDS TO THE SHOP,,https://www.reddit.com/r/london/r/london/comments/opz2df/new_lowtraffic_schemes_in_london_halve_number_of/h68d68l/,,"New low-traffic schemes in London halve number of road injuries, study shows"
comment,,2021-07-23 12:32:07,HOW WILL MY 99 YEAR OLD DISABLED NAN MOVE HER THREE FRIDGES AND A BUDGEY TO THE OTHER SIDE OF LONDON AT 5AM EVERY DAY NOW! DISGRACEFUL!,,https://www.reddit.com/r/london/r/london/comments/opz2df/new_lowtraffic_schemes_in_london_halve_number_of/h68f6qj/,,"New low-traffic schemes in London halve number of road injuries, study shows"
comment,,2021-07-23 12:13:40,"This is one of the two other overlooked externalities of car dependency; as well as pollution, cars cause congestion and a staggering amount of injuries and deaths. 24,000 a year, all avoidable.

Defenders of cars at all costs will point to the fact that compared to the millions of miles driven each year, deaths in cars are ‘acceptable’, but half the injuries and deaths caused by drivers in cars happen to people not in those cars. 

The leading cause of death in children in the UK is cars.",,https://www.reddit.com/r/london/r/london/comments/opz2df/new_lowtraffic_schemes_in_london_halve_number_of/h68dvuo/,,"New low-traffic schemes in London halve number of road injuries, study shows"
post,Should all of central London become one giant LTN?,2025-06-05 17:52:17,"I’m 100% serious. 

Central London is completely and utterly overstuffed with vehicles, and it’s a nightmare to travel through at the best of times - and that’s to say nothing about the pollution and lung destruction caused, the completely unnecessary traffic deaths, and the insane noise and stress that comes from just being exposed to that.

LTNs and pedestrianised zones are a *literal* breath of fresh air - no more having to worry about getting crushed by a speeding two tonne steel Kevin- or Karen-mobile.

Plus, without personal automobiles, there would be SO much more room for cyclists, which would also mean more room for pedestrians as we could expand the pavements.

Remember, cycling is a the most popular form of transportation in London now, the one least likely to cause the death of fellow road users. 

Clearly, there will need to be exceptions - blue badge holders, emergency vehicles and the like. Busses too, but even those would benefit since there would be virtually zero other traffic to contend with. Delivery drivers could be allowed only outside of peak hours (before 8am, let’s say)

Just the other day in my area, a driver was speeding at 40mph in a 20mph main road, and careened around a corner and hit another car and crushed 3 pedestrians agains the shopfront he ran them into. The paramedics had to literally salt the road to prevent the bloodstains from soaking in. 

I don’t  mean to be graphic, but this is the reality of living in a city congested with cars. 

So why not make it virtually impossible to drive one unless for the aforementioned exceptional circumstances?

Why keep allowing cars to take the piss?

EDIT: pedestrianisation would likely cause an economic boom amongst small businesses in those areas it was implemented as your footfall would be so much higher 

EDIT: yes, i’m fully aware this will either get downvoted to hell or become one of the most “controversial” posts on this subreddit - but i’ll steel man this position till the cows come home 

EDIT 3: wow, far more people agreed with this than I thought - Sadiq, can you get this done? ",451.0,https://www.reddit.com/r/london/r/london/comments/1l42p3u/should_all_of_central_london_become_one_giant_ltn/,LTN,
comment,,2025-06-05 18:20:57,"I'd go from Notting Hill to Liverpool Street, and from Camden down to about Waterloo/Bermondsey",,https://www.reddit.com/r/london/r/london/comments/1l42p3u/should_all_of_central_london_become_one_giant_ltn/mw5q2tc/,,Should all of central London become one giant LTN?
comment,,2025-06-05 18:37:29,"Sounds about right. That's a pretty good delimitation of the central area which is densely built and has extensive transport options. Getting around there by public transport, cycling or even walking is actually easier than driving in every way, and it'd be even better without the people who for some reason choose to drive there anyway lol. Zones 2-3 would need heavy investment in public transport - particularly tube lines across the outer zones, not just all aiming for central - before it'd become feasible to abandon cars altogether.",,https://www.reddit.com/r/london/r/london/comments/1l42p3u/should_all_of_central_london_become_one_giant_ltn/mw5tjjl/,,Should all of central London become one giant LTN?
comment,,2025-06-05 18:39:32,"Nah, eastwards at least until Aldgate/Whitechapel.",,https://www.reddit.com/r/london/r/london/comments/1l42p3u/should_all_of_central_london_become_one_giant_ltn/mw5tz6m/,,Should all of central London become one giant LTN?
comment,,2025-06-05 21:21:56,"This is the way

I'd also want to see from Camden to Holloway to Victoria Park included as well",,https://www.reddit.com/r/london/r/london/comments/1l42p3u/should_all_of_central_london_become_one_giant_ltn/mw6simk/,,Should all of central London become one giant LTN?
post,Someone's not happy about the new LTN! (Bounds Green).,2022-09-08 17:58:17,,309.0,https://www.reddit.com/r/london/r/london/comments/x9461e/someones_not_happy_about_the_new_ltn_bounds_green/,LTN,
comment,,2022-09-08 22:42:26,Been scrolling through the comments hoping someone has said something that’ll clue me in to what tf an LTN is.,,https://www.reddit.com/r/london/r/london/comments/x9461e/someones_not_happy_about_the_new_ltn_bounds_green/inmz6m5/,,Someone's not happy about the new LTN! (Bounds Green).
comment,,2022-09-08 22:58:45,"Thank you, will I sound stupid if I ask why that’s a bad thing. Sounds like neighbourhoods would be safer and less noisy with them but everyone here seems to be in agreement that they suck",,https://www.reddit.com/r/london/r/london/comments/x9461e/someones_not_happy_about_the_new_ltn_bounds_green/inn1rwg/,,Someone's not happy about the new LTN! (Bounds Green).
comment,,2022-09-08 23:05:01,"You won’t sound stupid at all. I live in Bounds Green/Bowes Park and it’s ridiculously fucking busy as we have a direct thoroughfare to the North Circular. Traffic here is ridiculous which means that pollution here is ridiculous.

But old posh assholes on Facebook groups are very angry because they refuse to take public transport and mingle with the public rabble. So they’ve been protesting this for years now.",,https://www.reddit.com/r/london/r/london/comments/x9461e/someones_not_happy_about_the_new_ltn_bounds_green/inn2rjd/,,Someone's not happy about the new LTN! (Bounds Green).
post,"Hostile West Dulwich LTN meeting 'left councillors in tears with traumatised staff offered leave', High Court told",2025-02-12 14:01:21,,161.0,https://www.reddit.com/r/london/r/london/comments/1inq8ms/hostile_west_dulwich_ltn_meeting_left_councillors/,LTN,
comment,,2025-02-12 15:08:39,"Its a really rough topic, because LTNs are almost always opposed more beforehand and then supported after implementation. People also have biases for how bad traffic will get on main roads, and how much shops depend on car trips (they often don’t and there’s some interesting research on London that suggests this is hugely overestimated).

This means there’s a clash between people and evidence. The best way is typically to trial a scheme and then if a permanent method (which likely functions a little better and looks better since it’s not cheaply thrown in).",,https://www.reddit.com/r/london/r/london/comments/1inq8ms/hostile_west_dulwich_ltn_meeting_left_councillors/mcd7ynu/,,"Hostile West Dulwich LTN meeting 'left councillors in tears with traumatised staff offered leave', High Court told"
comment,,2025-02-12 15:41:41,"My local corner shop has loads of anti-ltn stuff up but they are a corner shop in the middle of a residential area. Ten minutes walk is an Asda, ten the other way is a better Turkish corner shop. People aren't driving to them. Their business is all people walking under 5 minutes to get essentials.",,https://www.reddit.com/r/london/r/london/comments/1inq8ms/hostile_west_dulwich_ltn_meeting_left_councillors/mcddyrc/,,"Hostile West Dulwich LTN meeting 'left councillors in tears with traumatised staff offered leave', High Court told"
comment,,2025-02-12 16:15:01,"Same here, loads of anti-LTN signs up and down the road when it's a very dense area with a lot of public transport and many people here outright don't own cars because of that, or they can't afford a car. ",,https://www.reddit.com/r/london/r/london/comments/1inq8ms/hostile_west_dulwich_ltn_meeting_left_councillors/mcdkdx8/,,"Hostile West Dulwich LTN meeting 'left councillors in tears with traumatised staff offered leave', High Court told"
comment,,2025-02-12 22:02:42,"Newham have now done 7 and are getting pretty good at the consultation. Still got total nutjobs online and pretty good 'anti' coordination but the robust comms from the council helps. 

https://www.newham.gov.uk/transport-streets/low-traffic-neighbourhood/8

&gt; In 2021 we received a petition to ‘restrict rat running’ in the West Ham Park area, so we looked into the traffic data and found that half of the traffic in the area was not local, but rather, traffic using the neighbourhood as a shortcut. We looked into road safety statistics and found that there was on average, a casualty every 15 days over a four-year period.

&gt; The use of enforcement cameras and issuing fines is to prevent motor vehicles from driving through modal filters whilst allowing exempted motor vehicles to drive through. The main alternative to camera enforcement would be moveable gates or bollards, but consultation with police, fire and ambulance services shows this is not their preferred option and barriers would slow down their vehicles when every second counts in an emergency.

&gt; In Newham’s other LTNs, four of the five LTNs experienced a reduction in boundary road traffic by the end of the experimental scheme. There is also research from University of Westminster which monitored the 46 most recent LTN schemes in London and found that there was little change in boundary road traffic. It is important to note that we are not using these data to make assumptions about changes to traffic resulting from the West Ham Park LTN, but rather to demonstrate that it is reasonable to run an experimental scheme and to monitor traffic data closely.",,https://www.reddit.com/r/london/r/london/comments/1inq8ms/hostile_west_dulwich_ltn_meeting_left_councillors/mcfmu2h/,,"Hostile West Dulwich LTN meeting 'left councillors in tears with traumatised staff offered leave', High Court told"
post,Controversial LTN in one of London's most affluent neighbourhoods is shelved,2025-03-20 11:16:02,,125.0,https://www.reddit.com/r/london/r/london/comments/1jflm30/controversial_ltn_in_one_of_londons_most_affluent/,LTN,
comment,,2025-03-20 12:55:48,"saved me a click ty. not exactly the ""most"" affluent area but i guess ""above average"" wouldn't make a good headline.",,https://www.reddit.com/r/london/r/london/comments/1jflm30/controversial_ltn_in_one_of_londons_most_affluent/mis4kx1/,,Controversial LTN in one of London's most affluent neighbourhoods is shelved
comment,,2025-03-21 07:59:18,"Yes but headlines need to be concise, and if they'd written that instead it would have needed an extra, uh... minus 22 letters.",,https://www.reddit.com/r/london/r/london/comments/1jflm30/controversial_ltn_in_one_of_londons_most_affluent/mixokr0/,,Controversial LTN in one of London's most affluent neighbourhoods is shelved
post,Mum pleads with council to introduce stalled LTN after three-year-old sent flying by hit-and-run driver,2025-02-19 18:27:33,,73.0,https://www.reddit.com/r/london/r/london/comments/1itb3si/mum_pleads_with_council_to_introduce_stalled_ltn/,LTN,
