type,title,created_utc,body,num_comments,url,keyword_matched,parent_post_title
comment,,2023-03-10 14:18:05,"Honestly sick of the lack of thought of the anti-LTN morons, but I'm looking forwards to their spin on this.",,https://www.reddit.com/r/london/r/london/comments/11nln89/spending_up_on_church_street_as_town_hall_hails/jbo4y39/,,Spending up on Church Street as Town Hall hails LTN’s ‘positive impact on retail’ - Hackney Citizen
post,80% of Hackney LTN fines are to drivers based outside the borough,2021-06-30 14:37:51,,53.0,https://www.reddit.com/r/london/r/london/comments/oawg7z/80_of_hackney_ltn_fines_are_to_drivers_based/,LTN,
comment,,2021-06-30 16:51:40,"Everyone loves them who isn’t an entitled motorist (who are in a minority in London) 

Thank god councils have stopped building our cities to service their convenience",,https://www.reddit.com/r/london/r/london/comments/oawg7z/80_of_hackney_ltn_fines_are_to_drivers_based/h3ke9o7/,,80% of Hackney LTN fines are to drivers based outside the borough
comment,,2021-09-13 17:52:19,Of course it’s fucking East Ham,,https://www.reddit.com/r/london/r/london/comments/pnelbi/idiots_in_range_rovers/hcpc9ng/,,Idiots in Range Rovers?
comment,,2021-09-13 19:09:05,"Benson Avenue apparently. That's mental, until Feb I used to live 5-10min walk from there. Car robberies in that area of Newham are fairly common. I had a Romanian neighbour who bought a second hand BMW and had it checked, it was legit. Two weeks later police show up at his house and take it because it had been reported stolen a few days after he bought it. Mental.",,https://www.reddit.com/r/london/r/london/comments/pnelbi/idiots_in_range_rovers/hcpnfkv/,,Idiots in Range Rovers?
post,The middle-class volunteers thwarting council attempts to make thousands of pounds in LTN fines,2023-12-16 23:45:30,,8.0,https://www.reddit.com/r/london/r/london/comments/18k2p8q/the_middleclass_volunteers_thwarting_council/,LTN,
comment,,2023-12-17 00:00:14,"&gt; “One Saturday I stopped 150 vehicles saving motorists tens of thousands of pounds in one single day,” Mr Bennett, a retired accountant who lives within the new LTN, said.

When you’re so anti-LTN you don’t even realise you’re contributing to one.",,https://www.reddit.com/r/london/r/london/comments/18k2p8q/the_middleclass_volunteers_thwarting_council/kdoidun/,,The middle-class volunteers thwarting council attempts to make thousands of pounds in LTN fines
comment,,2023-12-17 02:15:01,"I mean... cool they're helping the LTN?

Seems weirdly ""the gubment shouldn't get muh money"" though with all the mentions of the council being Labour specifically.",,https://www.reddit.com/r/london/r/london/comments/18k2p8q/the_middleclass_volunteers_thwarting_council/kdp1qp0/,,The middle-class volunteers thwarting council attempts to make thousands of pounds in LTN fines
comment,,2023-12-18 01:47:26,"Even the campaigners don't understand the road signs. They complain in the article that the council hasn't used no entry signs, suggesting they think they mean the same thing.

The council has intentionally not used a no entry sign because non-motorised vehicles, such as bicycles, e-scooters, and horses, are allowed.",,https://www.reddit.com/r/london/r/london/comments/18k2p8q/the_middleclass_volunteers_thwarting_council/kdturba/,,The middle-class volunteers thwarting council attempts to make thousands of pounds in LTN fines
comment,,2025-05-24 12:08:04,Different demographic so they don't mind,,https://www.reddit.com/r/london/r/london/comments/1ku74bk/campaigners_launch_fresh_legal_bid_to_block/mtzhhi8/,,Campaigners launch fresh legal bid to block Brockwell Park festivals
post,Ogmios School of Zen Motoring Ep 6 - LTN | ASMR DASHCAM |,2022-12-14 21:12:32,,3.0,https://www.reddit.com/r/london/r/london/comments/zm0xls/ogmios_school_of_zen_motoring_ep_6_ltn_asmr/,LTN,
post,"Anti-LTN group asks “is local democracy broken?”, charges £5 for the answer.",2021-09-12 22:46:52,,12.0,https://www.reddit.com/r/london/r/london/comments/pn0sdb/antiltn_group_asks_is_local_democracy_broken/,LTN,
comment,,2021-09-13 10:08:35,"The old propaganda is open debate bullshit.

Personally I'm thrilled by every new LTN and can't wait for more.",,https://www.reddit.com/r/london/r/london/comments/pn0sdb/antiltn_group_asks_is_local_democracy_broken/hco1rkv/,,"Anti-LTN group asks “is local democracy broken?”, charges £5 for the answer."
comment,,2021-09-13 12:04:06,"Me too, I go out of my way to respond to every council survey to sing their praises, and ask for more.

It only fuels me seeing how angry some people get about it.",,https://www.reddit.com/r/london/r/london/comments/pn0sdb/antiltn_group_asks_is_local_democracy_broken/hco97a8/,,"Anti-LTN group asks “is local democracy broken?”, charges £5 for the answer."
comment,,2021-09-12 23:01:05,"Oh wow, it would be good to have some impartial unbiased discussion to establish the best policies for our neighbourhoods!  Let’s check out their website, http://londondemocrats.org/

&gt; We are democrats who believe in dialogue, taking the public seriously as capable, active citizens. Let’s defend our right to make our own choices, without being patronised, preached to or demonised. Come join us!

Sounds great!

&gt; How LTNs have torn communities apart
Niall Crowley is quoted in this [article originally published in spiked](http://londondemocrats.org/how-ltns-have-torn-communities-apart/). By Tim Black. The undemocratic imposition of road closures by local councils is a...

Oh, I see.

&gt; As Niall Crowley, a spiked contributor now standing as a candidate in council byelections in Hoxton East and Shoreditch, told the Guardian, ‘If you’re going to treat residents as a problem to be managed or nudged, then what kind of democracy is that?’. Quite.

Errr so he’s a spiked contributor as well?  Spiked of course is the very normal group of people who [spun out of the Revolutionary Communist Party](https://www.google.co.uk/amp/s/amp.theguardian.com/commentisfree/2020/jun/20/the-far-left-origins-of-no-10s-desperate-attack-on-all-things-woke-) then became fringe right wingers and continue their trolling for dollaz at spiked.  Aside from Munira Mirza, of course, who instead became an advisor in Number 10 to a Mr Johnson.

Oh and of course they [get funding from the Kochs](https://www.theguardian.com/commentisfree/2018/dec/07/us-billionaires-hard-right-britain-spiked-magazine-charles-david-koch-foundation?CMP=Share_iOSApp_Other) - the US billionaires who fund right wing nonsense around the world, in particular this sort of fringey fake grass roots garbage.

Two days ago Spiked published this iconic [tweet](https://twitter.com/spikedonline/status/1436343956581801985?s=21):

&gt; People forget just how “woke” al-Qaeda was. Bin Laden was an environmentalist, he believed in cancel culture, and he embraced the Islamist politics of victimhood. 9/11 was a hyper-violent form of identity politics, says Brendan O’Neill

So, yeah, the usual weirdo right wingers that want to halt any change in London - even something as trivial as “wouldn’t it be nice if there were less fucking cars in Stoke Newington”.  Absolutely go fuck yourselves.",,https://www.reddit.com/r/london/r/london/comments/pn0sdb/antiltn_group_asks_is_local_democracy_broken/hcm02h5/,,"Anti-LTN group asks “is local democracy broken?”, charges £5 for the answer."
post,Islington Council 'sorry' after Highbury LTN fiasco,2022-03-15 19:17:39,,7.0,https://www.reddit.com/r/london/r/london/comments/tevtq3/islington_council_sorry_after_highbury_ltn_fiasco/,LTN,
comment,,2022-03-16 12:39:42,So much drama about these LTN's on Nextdoor!,,https://www.reddit.com/r/london/r/london/comments/tevtq3/islington_council_sorry_after_highbury_ltn_fiasco/i0vfhqo/,,Islington Council 'sorry' after Highbury LTN fiasco
comment,,2022-03-15 22:35:50,"&gt; and systra is not a very reliable source anyway.

How so?

&gt; how are we supposed to know when and where they took the readings?

The council shouldn't have apologised if they weren't shown the data and timelines.",,https://www.reddit.com/r/london/r/london/comments/tevtq3/islington_council_sorry_after_highbury_ltn_fiasco/i0sxwne/,,Islington Council 'sorry' after Highbury LTN fiasco
comment,,2022-03-15 22:58:07,"Because they're not an independent auditor. They have multiple contracts with multiple councils, and Project Centre is an obvious competitor.  
You wouldn't ask Pepsi for an independent audit on Coke.  


Also, wherever systra has done the local surveys, there were thousands of duplicate entries.",,https://www.reddit.com/r/london/r/london/comments/tevtq3/islington_council_sorry_after_highbury_ltn_fiasco/i0t1egl/,,Islington Council 'sorry' after Highbury LTN fiasco
comment,,2025-06-17 14:53:45,People probably notice but they are too London to say anything,,https://www.reddit.com/r/london/r/london/comments/1ldk5u1/i_left_london_but_london_hasnt_left_me/my97aiv/,,I left London but London hasn't left me
comment,,2023-05-12 16:55:55,"Honestly it seems most of the traffic in the morning is people taking their kids to school. There is a significant reduction in traffic during the school holidays which I always assumed it was because most people take time off in the school holidays, until during covid. The roads were empty until the day the kids went back to school, then it went back to almost pre lockdown levels of traffic. Considering WFH was still ongoing it was like everyone had nothing better to do than get in the car &amp; drive their kids.

Considering under 16s get free travel &amp; most people live locally to their schools I don't understand why most kids (especially at secondary school age) aren't getting the bus.",,https://www.reddit.com/r/london/r/london/comments/13ey5dj/each_car_in_london_costs_nhs_and_society_8000_due/jjvpizv/,,"Each car in London costs NHS and society £8,000 due to air pollution, report finds."
post,London’s road system has a mind of its own… literally!,2025-02-07 13:37:21,"Was planning my route and suddenly realized… the roads look just like a brain. Maybe it’s just me, but once I saw it, I couldn’t unsee it. Kinda fitting, considering how unpredictable London traffic can be!",69.0,https://www.reddit.com/r/london/r/london/comments/1iju0py/londons_road_system_has_a_mind_of_its_own/,LTN,
comment,,2025-02-07 23:33:29,"Yep, and you get stuck in traffic going to wrong direction than your original location, but you’ve committed to the route so are forced to continue",,https://www.reddit.com/r/london/r/london/comments/1iju0py/londons_road_system_has_a_mind_of_its_own/mbk5z6c/,,London’s road system has a mind of its own… literally!
comment,,2025-06-05 18:15:21,"JFC what appalling headline writing.

For anyone who didn't read the article (which is fair, most of don't) what this means is: cross-river traffic down 12% following introduction of tolls.

Avoiding does not mean ""using the tunnels but not paying"" as might be assumed.

Reducing cross river traffic was **one of the things that the tolls were supposed to do**. Of course traffic is down. Nobody who is not a complete lunatic would expect *more* people to use the tunnels when you start charging for them.",,https://www.reddit.com/r/london/r/london/comments/1l42f1p/12000_drivers_a_day_are_avoiding_blackwall_and/mw5owtd/,,"12,000 drivers a day are avoiding Blackwall and Silvertown tunnel tolls, TfL reveals"
comment,,2025-06-05 23:16:55,this series of posts is confusing me. Are we supposed to be happy or upset that cross river traffic is down.,,https://www.reddit.com/r/london/r/london/comments/1l42f1p/12000_drivers_a_day_are_avoiding_blackwall_and/mw7gwim/,,"12,000 drivers a day are avoiding Blackwall and Silvertown tunnel tolls, TfL reveals"
comment,,2025-08-16 12:59:05,"If you're a cyclist, happy (for reasoning they never provide). 
If you're one of the companies that loaned TFL the money, happy.


Pretty much everyone else has lost out. Money could have been put in the local economy, they could have placed the new tunnel somewhere that reduced traffic rather than simply doubling capacity in one place and causing people to move over to other highly used but still free routes",,https://www.reddit.com/r/london/r/london/comments/1l42f1p/12000_drivers_a_day_are_avoiding_blackwall_and/n8zm98j/,,"12,000 drivers a day are avoiding Blackwall and Silvertown tunnel tolls, TfL reveals"
comment,,2025-06-05 18:47:37,Reducing unnecessary car use and reducing traffic delays for those who need to use their cars/vans. It’s working wonderfully as intended so far.,,https://www.reddit.com/r/london/r/london/comments/1l42f1p/12000_drivers_a_day_are_avoiding_blackwall_and/mw5vopy/,,"12,000 drivers a day are avoiding Blackwall and Silvertown tunnel tolls, TfL reveals"
comment,,2021-04-29 19:40:29,Hell yes they are,,https://www.reddit.com/r/london/r/london/comments/n18s81/good_evening_rlondon_im_jago_hazzard_film_maker/gwblvzd/,,"Good evening, r/London! I’m Jago Hazzard, film maker and sort-of historian, AMA."
comment,,2023-12-13 20:20:52,Definitely! Regretting what I tried now.,,https://www.reddit.com/r/london/r/london/comments/18hojrq/whats_up_with_transport_in_the_last_week_or_so/kd7vqh6/,,What's up with transport in the last week or so?
comment,,2023-12-14 00:55:56,"It's for safety reasons. If you just let people crowd into the station, you'd most likely have people being (accidentally) crushed or pushed onto the track",,https://www.reddit.com/r/london/r/london/comments/18hojrq/whats_up_with_transport_in_the_last_week_or_so/kd922f9/,,What's up with transport in the last week or so?
comment,,2024-03-14 12:11:27,or scrap LTN's,,https://www.reddit.com/r/london/r/london/comments/1be02fm/the_congestion_on_the_bus_routes_is_embarrassing/kuth3k1/,,The congestion on the bus routes is embarrassing
comment,,2024-03-15 12:33:59,"To all who downwoted me: please explain to me how LTN's are not increasing congestion and are making air cleaner: before Highbury LTN, I could drive from Kelvin Rd N5 to Hornsey St (next to Holloway Rd tube) in 7 minutes. Since Highbury Hill, Drayton Pk and Benwell Rd are closed and within LTN I have to use Highbury Corner and it takes 22mins to do the same journey. 
How are you going to prove that vehicle driven for 22mins creates less polution than when its driven for 7 mins?
And please do not tell me to walk, I drive commercial vehicle. 
LTN's dont work, only push traffic to the main roads.",,https://www.reddit.com/r/london/r/london/comments/1be02fm/the_congestion_on_the_bus_routes_is_embarrassing/kuz5z9n/,,The congestion on the bus routes is embarrassing
comment,,2023-10-21 13:12:21,"I'm in the hinterland between Camberwell and Brixton but not the Loughborough Junction bit.  Even Estate Agents are unsure whether to call it Camberwell, Brixton or Loughborough Junction and it's not trendy enough to call 'Vibrant'.  I once saw it called Stockwell but that was a mighty stretch. Like calling Peckham Dulwich.

I was born in 1955 and have lived locally all my born days. The area has changed a lot since the 1980s. There was a thriving, if not hugely lucrative local economy but also grinding poverty, loads of WW2 bomb-sites, crumbling Victorian blocks of big, once grand houses converted into shitty bedsits with shared stoves and inadequate toilets on the landings (I was told the very worst were owned by greedy evil twins but whether the Barclay brothers or the Krays, I couldn't tell you). 

There's a network of Victorian railway viaducts which once had lots of small businesses in the arches. Fruit wholesalers, mechanics, stabled ponies, rag merchants, market traders, all sorts. The arches look swanky and uniform and have been refurbished with shiny shutters replacing the big old wooden doors. Many are unoccupied, the rents are now ridiculous. Since gentrification lots of people have been pushed out and priced out and many useful shops and businesses have been replaced with bars and trendy food places. The strong communities that remain are the Estates. The Council ones I mean, not the gated communities like the one built where the best local comprehensive school was deliberately run down, sold and demolished. 

In some ways gentrification has shut down opportunities for the less well-heeled but now there's a big shortage of reliable dog-walkers, childcare and charladies. I'd never move away despite being sad at who and what's gone. I've watched people go to school together, get married, have kids, have grandchildren. I am rooted here. People know me and I know them. We look out for each other. I didn't work further away than I could walk to until I was nearly 50 (I did take a bus on rainy days). Local work gradually got scarcer, less varied. One thing London has lost is small manufacturers. There were even a few larger factories eg R. Whites lemonade in Camberwell. One of my great-aunts worked her whole life at Price's candle factory in Vauxhall. She used to boast she'd made the candles for the Coronation and the family joke was 'Which one?' 

The thing I do really like is we have horses and ponies again. There used to be loads. Some belonged to Gypsies and Travellers, some for rag &amp; bone, small commercial traders who loved their horses and kept one or two although they mostly drove about in Commer vans. The arches were cheap to rent and lots of ponies were stabled in the arches. Eventually the only horses left were the police horses at Brixton. I loved hearing them at night slowly clip-clopping through the back roads to Brixton after football matches at Charlton or Millwall. It was sad when they left.

A small local kids charity run out of a kitchen took kids kayaking, riding, to the seaside or whatever, things they would never normally get to do. They raised enough money to open a riding charity. There are horses under the arches again!",,https://www.reddit.com/r/london/r/london/comments/17cwjam/rlondon_what_neighbourhood_do_you_live_in_what_do/k5tegj7/,,"r/London, what neighbourhood do you live in? What do you love or hate about it?"
comment,,2023-10-22 05:57:24,"That the one at Loughborough junction? I was there a few weeks ago with my son (2) and he lost his shit when he saw the horses. We had to go over and just stand looking at them while he pointed at them and shouted ""neigh"".",,https://www.reddit.com/r/london/r/london/comments/17cwjam/rlondon_what_neighbourhood_do_you_live_in_what_do/k5xb7cv/,,"r/London, what neighbourhood do you live in? What do you love or hate about it?"
comment,,2025-09-17 01:58:59,"They just rejected one scheme, turning the bathhouse into a cinema",,https://www.reddit.com/r/london/r/london/comments/1nic96p/what_are_our_councils_doing/nem9tvc/,,What are our councils doing?
comment,,2025-10-28 11:54:31,"The people in private flats in Enfield had the chance to make a few quid outta it but didn't take the great offer, shooting themselves in the foot.",,https://www.reddit.com/r/london/r/london/comments/1oi471a/what_are_our_councils_doing/nlt2e0b/,,What are our councils doing?
comment,,2022-10-31 20:13:19,"The issue is that when the onus is on the individual, they end up feeling like a mug when someone else chooses to ignore. It’s becomes a zero sum game where people don’t see the point in giving up their cars because others will continue to drive theirs.

They just need to put the squeeze on people and either ban private cars outright apart from exceptional circumstances, or just make owning a car in London a completely joyless experience. Have an approved list of vehicles, require a yearly license for ownership and pedestrianise or ban private vehicles from vast swathes of the roads.

If you ensure that people are driving smaller, slower vehicles, the roads will be much safer for cycling. I currently take public transport exclusively because I don’t have the confidence to ride a bike on London roads.",,https://www.reddit.com/r/london/r/london/comments/yifdrk/how_to_reduce_car_trafic_in_london/iuj8xhg/,,How to reduce car trafic in London ?
comment,,2022-10-31 20:39:39,"That is why I think clever policy design is the solution.

People shouldn't feel like they're ""giving up"" something, the system should be design in a way that makes not using the car the best option.

I can see 3 types of incentives:

* Make it cheaper
* Make it easier 
* Make it quicker 

I think driving in London is already a completely joyless experience, and I don't really understand why people still do it, hence my question to drivers.",,https://www.reddit.com/r/london/r/london/comments/yifdrk/how_to_reduce_car_trafic_in_london/iujctbs/,,How to reduce car trafic in London ?
comment,,2022-11-01 00:09:50,"I’d say a lot of it is 100+ years of auto industry marketing thats led people to believe they need a car in the same way they need a house, clothes and food.

Also public transport outside the capital is abysmal so you’d need to solve that.",,https://www.reddit.com/r/london/r/london/comments/yifdrk/how_to_reduce_car_trafic_in_london/iuk5ren/,,How to reduce car trafic in London ?
comment,,2018-11-06 08:23:25,"I've just been through this... I didn't find it so terrible- there's a high demand so good places go quick. It's relentless, but you gotta play the game if you wanna rent! I wonder if it's like this with actually buying?

What we learnt- if you like It, don't delay, put in an offer immediately. We saw about 10 places - definitely didn't see any dog shit! but there were a lot of flats that just weren't nice.

Found one in the end! Had to go a little above our budget but I hope it's worth it 😁

",,https://www.reddit.com/r/london/r/london/comments/9uj0pd/observations_on_flat_hunting_in_london/e95bo8u/,,Observations on flat hunting in London
comment,,2018-11-06 11:46:00,"I've never rented (was lucky enough to live with the parents while saving to buy a place) but the process sounds the same. Giving out your details to like 10 different agencies to keep and eye out for what you're after and only being offered something totally different or way out of the price range. The constant phone calls asking for updates etc and huge amounts of emails with new options that have popped up. I did love how quickly the emails and calls stopped once you told them you were finished with your search, I really appreciated that.",,https://www.reddit.com/r/london/r/london/comments/9uj0pd/observations_on_flat_hunting_in_london/e95hgx4/,,Observations on flat hunting in London
comment,,2018-11-06 13:00:15,"Can't say I've had this issue, there isn't really any reason to give an agency your details as pretty much all rental properties are on aggregate sites like Rightmove. Go see the places that suit your needs, make an offer if you want to live there, In 3-4 moves I've never had constant phone calls and being sent different options was just their random marketing emails which you just unsubscribe from. The only caveat being that in London you have to move quickly. If a property has been up for months you can pretty much ignore it as plenty of people will have viewed it and found its a shithole.",,https://www.reddit.com/r/london/r/london/comments/9uj0pd/observations_on_flat_hunting_in_london/e95jw2s/,,Observations on flat hunting in London
comment,,2020-07-08 12:04:09,"The new flats on the high street are quiet and well insulated. This is great in the winter as you'll be nice and warm but poses two problems in the summer (even with this year's feeble attempt at summer).

1. The flats quickly heat up to an uncomfortable temperature.

2. When you open the windows it is very very noise unless you are 7 or 8 floors up. There's a lot of traffic from emergency vehicles getting through East London. Also the high street is wide and straight, a favourite for racers. Maybe once every couple months someone will wrap their Audi around a traffic sign.






East village, by the trains is similar to the high street but there is constant low level noise. When commuter trains stop, you'll still have engineering works and goods trains.

East village, around the park is very quiet, you'll get the odd ambulance but that's about it. Emergent service vehicles won't drive through East village unless there is an incident in East village. It's faster for them to go around.



East village on the edge of Elizabeth park is  better than the high street if you can afford it. It is quieter, local shops and closer to the main train /tube/bus connections. You have the park, not too far from Victoria park and a canal to walk along. It has a faux sanatised community feel about it and overall doesn't have any edginess. 

It's also more expensive",,https://www.reddit.com/r/london/r/london/comments/hndwzb/stratford_high_street_and_east_village_is_it/fxarg74/,,Stratford (High Street and East Village): is it noisy at night?
comment,,2020-07-08 19:47:05,"Pimlico if you can afford it, or the edges of Canary wharf. There's quite a few converted warehouses, so they'll be spacious and quiet. Despite the sketchy appearance the biggest sexual threat is likely going to be from coked up wannabe traders on Thursday/Friday evening",,https://www.reddit.com/r/london/r/london/comments/hndwzb/stratford_high_street_and_east_village_is_it/fxc2dkm/,,Stratford (High Street and East Village): is it noisy at night?
comment,,2020-07-09 10:02:51,"You won't get ""quiet"" unless you move out a bit, or can afford the small enclaves of residential central London. Anywhere near a main road will be plagued with sirens 24/7. 3 stops further out from Stratford on the Central Line and you can find quiet.",,https://www.reddit.com/r/london/r/london/comments/hndwzb/stratford_high_street_and_east_village_is_it/fxeibf0/,,Stratford (High Street and East Village): is it noisy at night?
