type,title,created_utc,body,num_comments,url,keyword_matched,parent_post_title
post,"Just ignore all the myths about low traffic neighbourhoods: they’re popular, effective and here to stay",2025-05-23 14:05:52,,126.0,https://www.reddit.com/r/london/r/london/comments/1kthv1g/just_ignore_all_the_myths_about_low_traffic/,low traffic neighbourhood,
comment,,2025-05-23 16:30:42,Our road was closed for a month due to roadworks and it was BEAUTIFUL and quiet. Also neighbours who have cars could still access it and there was loads of parking space (usually it’s all parked up),,https://www.reddit.com/r/london/r/london/comments/1kthv1g/just_ignore_all_the_myths_about_low_traffic/mtuasjf/,,"Just ignore all the myths about low traffic neighbourhoods: they’re popular, effective and here to stay"
comment,,2025-05-23 17:16:30,"I enjoyed watching the anti-LTN protests in my neighbourhood dwindle from 50-60 down to 2 adults and a child, over the course of 6 months. 

Their finest moment was driving a massive New York taxi up onto the pavement on our local high street one busy weekend, in order to…assert the dominance of the car? I don’t know.

Their lowest point was closing down a council meeting with their appalling behaviour. That and the violent language directed towards councillors, myself and other locals, the bigotry, and sundry insults. That’s all they have, the people who want to drive their cars anywhere and everywhere; bad faith, lies, insults and threats. Apparently I’m a Stalinist, and a Nazi. Fuck you Steve.",,https://www.reddit.com/r/london/r/london/comments/1kthv1g/just_ignore_all_the_myths_about_low_traffic/mtukewi/,,"Just ignore all the myths about low traffic neighbourhoods: they’re popular, effective and here to stay"
comment,,2025-05-23 20:46:37,"They totally dwindled to nothing in Crystal Palace after the council removed the restrictions including a bus gate, both massively popular amongst locals.",,https://www.reddit.com/r/london/r/london/comments/1kthv1g/just_ignore_all_the_myths_about_low_traffic/mtvsmer/,,"Just ignore all the myths about low traffic neighbourhoods: they’re popular, effective and here to stay"
post,London council ordered to remove unlawful Low Traffic Neighbourhood that raked in £1million in fines,2025-06-05 08:33:07,,156.0,https://www.reddit.com/r/london/r/london/comments/1l3sapu/london_council_ordered_to_remove_unlawful_low/,low traffic neighbourhood,
comment,,2025-06-05 08:54:14,It’s Lambeth Council. LTN is in West Dulwich. Click saved.,,https://www.reddit.com/r/london/r/london/comments/1l3sapu/london_council_ordered_to_remove_unlawful_low/mw3e5h2/,,London council ordered to remove unlawful Low Traffic Neighbourhood that raked in £1million in fines
comment,,2025-06-05 10:10:32,"No surprised. The LTNs in Lambeth and Streatham are, shall we say, very strategically placed. I got caught out by one when I lived there which was literally a 20ft stretch of road leading onto the south circular. I was just dropping my toddler off at nursery before driving to a client site. I didn’t see it, which is my bad, but if I’d avoided it I’d have to have driven back through three residential roads as opposed to simply past a church.",,https://www.reddit.com/r/london/r/london/comments/1l3sapu/london_council_ordered_to_remove_unlawful_low/mw3lx8k/,,London council ordered to remove unlawful Low Traffic Neighbourhood that raked in £1million in fines
comment,,2025-06-05 11:08:08,"Hillside Road, I take it. 

It’s strategically placed to give Rezina Chowdhury a nicer street to live on.",,https://www.reddit.com/r/london/r/london/comments/1l3sapu/london_council_ordered_to_remove_unlawful_low/mw3rlic/,,London council ordered to remove unlawful Low Traffic Neighbourhood that raked in £1million in fines
comment,,2025-06-05 11:20:48,"Oh yeah, I know that one too. There was never a traffic issue round there, but their meddling elsewhere had the potential to cause one. So in go cameras, signs and then watch the money roll in.",,https://www.reddit.com/r/london/r/london/comments/1l3sapu/london_council_ordered_to_remove_unlawful_low/mw3supg/,,London council ordered to remove unlawful Low Traffic Neighbourhood that raked in £1million in fines
post,March in Northfields to protest the setup of new LTN (Low Traffic Neighbourhood) without public consultation,2020-09-12 16:05:28,,318.0,https://www.reddit.com/r/london/r/london/comments/ird6cy/march_in_northfields_to_protest_the_setup_of_new/,low traffic neighbourhood,
comment,,2020-09-12 16:37:51,"Agreed. It might be poorly executed and ill thought out but no amount of public consultation will change the fact that this is something that needs to happen. The idea isn't to make a small number of arterial roads jam packed with cars - the idea is to make a small number of arterial roads so jam packed with cars that people wake up and go 'fuck this, I'm not using my car'. Every protester I saw today was talking about care workers and disabled access, as though this is the critical argument that must be considered in combatting climate change...

Roads to every front door cannot remain the norm. Workaround solutions must absolutely be provided for the elderly and disabled, but not at the cost of derailing green progress.",,https://www.reddit.com/r/london/r/london/comments/ird6cy/march_in_northfields_to_protest_the_setup_of_new/g4xl5o1/,,March in Northfields to protest the setup of new LTN (Low Traffic Neighbourhood) without public consultation
comment,,2020-09-13 11:41:56,"Exactly. I lived in the Netherlands for a while and it was really noticeable and pleasing to see how the cycle infrastructure also benefited wheelchair users - lots of people bombing along on those setups with handcranks. No need to worry about paths suddenly ending or big curb stones to negotiate, and of course most bridges either have a low gradient slope or a lift to get on or off. I'm sure there are still some issues there but it's really not that hard to significantly improve our urban areas for all users!",,https://www.reddit.com/r/london/r/london/comments/ird6cy/march_in_northfields_to_protest_the_setup_of_new/g52vl4k/,,March in Northfields to protest the setup of new LTN (Low Traffic Neighbourhood) without public consultation
post,Rishi Sunak’s report finds low-traffic neighbourhoods work and are popular,2024-03-08 20:00:34,,57.0,https://www.reddit.com/r/london/r/london/comments/1b9w4go/rishi_sunaks_report_finds_lowtraffic/,low traffic neighbourhood,
comment,,2024-03-08 20:03:01,"Apparently this is about a different report than the one which Peter Walker [also wrote about](/r/london/comments/1b9k047/health_gains_of_lowtraffic_schemes_up_to_100/) in the Graun today.

That they tried to bury the report is yet another sign that tories only like the evidence when the evidence agrees with them.",,https://www.reddit.com/r/london/r/london/comments/1b9w4go/rishi_sunaks_report_finds_lowtraffic/ktygtaj/,,Rishi Sunak’s report finds low-traffic neighbourhoods work and are popular
comment,,2024-03-08 20:36:40,"Now, to be fair, Sunak only said he was going to get rid of ""hare-brained"" LTNs. It's this sort of clear, decisive language that'll win him the next election.",,https://www.reddit.com/r/london/r/london/comments/1b9w4go/rishi_sunaks_report_finds_lowtraffic/ktymt6f/,,Rishi Sunak’s report finds low-traffic neighbourhoods work and are popular
comment,,2024-03-08 23:28:33,"""In each of the schemes, the percentage of people backing the LTNs was between 19 points and 31 points higher than the percentage opposed. In a sign that the controversy about the schemes might be largely generated by politicians and the media, 58% of people did not even know they lived in an LTN.""


Conservatives are really desperate ",,https://www.reddit.com/r/london/r/london/comments/1b9w4go/rishi_sunaks_report_finds_lowtraffic/ktzh1yh/,,Rishi Sunak’s report finds low-traffic neighbourhoods work and are popular
comment,,2024-03-09 10:02:28,Christ yes. Block and move on.,,https://www.reddit.com/r/london/r/london/comments/1b9w4go/rishi_sunaks_report_finds_lowtraffic/ku1pxkf/,,Rishi Sunak’s report finds low-traffic neighbourhoods work and are popular
post,Sunak orders review of London low traffic neighbourhoods as it may limit the freedom of drivers,2023-07-30 20:25:01,,107.0,https://www.reddit.com/r/london/r/london/comments/15dsish/sunak_orders_review_of_london_low_traffic/,low traffic neighbourhood,
comment,,2023-07-30 23:50:43,It’s supposed to limit the ‘freedom’ of drivers. That’s the point.,,https://www.reddit.com/r/london/r/london/comments/15dsish/sunak_orders_review_of_london_low_traffic/ju4j99g/,,Sunak orders review of London low traffic neighbourhoods as it may limit the freedom of drivers
post,Low traffic neighbourhood in Lambeth scrapped after 'causing huge problems',2024-03-07 14:33:30,,75.0,https://www.reddit.com/r/london/r/london/comments/1b8ura4/low_traffic_neighbourhood_in_lambeth_scrapped/,low traffic neighbourhood,
comment,,2024-03-07 14:45:32,"Council has listened to residents and temporarily suspended it while there are roadworks in the A23, not scrapped",,https://www.reddit.com/r/london/r/london/comments/1b8ura4/low_traffic_neighbourhood_in_lambeth_scrapped/ktrjnhk/,,Low traffic neighbourhood in Lambeth scrapped after 'causing huge problems'
comment,,2024-03-07 15:06:17,"I can’t find a source for any firm indication of when it will be back. The Thames Water works are ongoing and adhoc (so not just a single project which will take x amount of time) and because that causes issues with public transport, this LTN has been removed. I suspect it will stay like this for the long term too, though the LTN was an absolute cash cow for Lambeth (£300k+ in fines alone).",,https://www.reddit.com/r/london/r/london/comments/1b8ura4/low_traffic_neighbourhood_in_lambeth_scrapped/ktrmpbx/,,Low traffic neighbourhood in Lambeth scrapped after 'causing huge problems'
comment,,2024-03-07 15:39:25,"True, but £300k from a *single* LTN is nothing to sniff your nose at either. It probably won’t be a strong enough reason to bring the LTN back given residents’ (and TfL’s) complaints though.",,https://www.reddit.com/r/london/r/london/comments/1b8ura4/low_traffic_neighbourhood_in_lambeth_scrapped/ktrru43/,,Low traffic neighbourhood in Lambeth scrapped after 'causing huge problems'
comment,,2024-03-07 15:42:22,"Equates to something like 2500 fines if its £130 per fine?

Tbh considering the amount of vehicles that ran through the Streatham Wells LTN it's lower than I expected.",,https://www.reddit.com/r/london/r/london/comments/1b8ura4/low_traffic_neighbourhood_in_lambeth_scrapped/ktrsbav/,,Low traffic neighbourhood in Lambeth scrapped after 'causing huge problems'
post,High Court battle looms over bid by Tower Hamlets to axe low traffic neighbourhoods - Evening Standard,2024-02-22 11:17:57,,33.0,https://www.reddit.com/r/london/r/london/comments/1ax33sc/high_court_battle_looms_over_bid_by_tower_hamlets/,low traffic neighbourhood,
comment,,2024-02-22 13:12:04,"This is yet another reminder that Lutfur Rahman and his cronies are a bunch of corrupt crooks.

Edit: [the government inspectors are launching an investigation against him!](https://www.reddit.com/r/london/comments/1ax7x5r/tower_hamlets_uk_government_inspectors_review/)",,https://www.reddit.com/r/london/r/london/comments/1ax33sc/high_court_battle_looms_over_bid_by_tower_hamlets/krli0a6/,,High Court battle looms over bid by Tower Hamlets to axe low traffic neighbourhoods - Evening Standard
post,Opposition to Low Traffic Neighbourhoods now sending death threats to councillors,2020-09-25 16:52:55,,117.0,https://www.reddit.com/r/london/r/london/comments/izkv2y/opposition_to_low_traffic_neighbourhoods_now/,low traffic neighbourhood,
comment,,2020-09-25 17:02:21,"Just shows the sheer level of entitlement of some car drivers. Not only do they think they should be allowed to drive whenever and wherever they want, not only do they believe their personal convenience is worth sacrificing the health and wellbeing of millions for, but some now seem to think that having to take a diversion so that people can live on quieter, more pleasant streets is worth sending death threats over.

I really hope local councils stay strong about making London a better place to live.",,https://www.reddit.com/r/london/r/london/comments/izkv2y/opposition_to_low_traffic_neighbourhoods_now/g6jh5o3/,,Opposition to Low Traffic Neighbourhoods now sending death threats to councillors
comment,,2020-09-29 15:53:36,"In Greenwich/Lewisham?

If so, this was me! They started calling me a misogynist, sexist, and a bully on every single comment I made, even though I was being incredibly polite and literally only stating facts.

This one particular woman said ""I hope you get crippling arthritis"" and told me to ""suck on an exhaust pipe"" because I said that I support LTNs and cycle lanes.

Now I'm banned from Nextdoor for 2 weeks because she got all of her fellow bigots to report me. It's so hilarious petty. I love it. I'll be back on October 10th.",,https://www.reddit.com/r/london/r/london/comments/izkv2y/opposition_to_low_traffic_neighbourhoods_now/g725d89/,,Opposition to Low Traffic Neighbourhoods now sending death threats to councillors
comment,,2020-09-29 22:29:50,"Yep there was only one other person a day or so later who made a really light defence of cycle lanes and they immediately said ""oh look another male cyclist..."" but he called them out on their sexism and they backed off a bit.",,https://www.reddit.com/r/london/r/london/comments/izkv2y/opposition_to_low_traffic_neighbourhoods_now/g73oscg/,,Opposition to Low Traffic Neighbourhoods now sending death threats to councillors
post,North london not happen with the LTN (Low Traffic Neighbourhood) messures put in place.,2022-11-20 14:51:42,,77.0,https://www.reddit.com/r/london/r/london/comments/z04mzd/north_london_not_happen_with_the_ltn_low_traffic/,low traffic neighbourhood,
comment,,2022-11-20 15:03:35,Good to see the LTN promoting the ability to walk and cycle to the town hall.,,https://www.reddit.com/r/london/r/london/comments/z04mzd/north_london_not_happen_with_the_ltn_low_traffic/ix3j5k5/,,North london not happen with the LTN (Low Traffic Neighbourhood) messures put in place.
comment,,2022-11-21 11:01:18,"I live in Tottenham and the LTN issue is the new Brexit - can't even walk my dog without someone flipping a ""morning, nice day for it"" conversation to either for or against LTNs 🤦‍♂️

(i'm 100% for LTNs - cleaner air and safer streets for my kids, no-brainer)",,https://www.reddit.com/r/london/r/london/comments/z04mzd/north_london_not_happen_with_the_ltn_low_traffic/ix7iyw8/,,North london not happen with the LTN (Low Traffic Neighbourhood) messures put in place.
comment,,2022-11-20 15:15:38,Is this against or for Cars? Can't work it out as the grammar is so awful.,,https://www.reddit.com/r/london/r/london/comments/z04mzd/north_london_not_happen_with_the_ltn_low_traffic/ix3kjwv/,,North london not happen with the LTN (Low Traffic Neighbourhood) messures put in place.
post,"The Daily Mail's ""exclusive"" on a 15 metre stretch of an Islington side street.",2023-03-27 06:45:31,,367.0,https://www.reddit.com/r/london/r/london/comments/123bprx/the_daily_mails_exclusive_on_a_15_metre_stretch/,low traffic neighbourhood,
comment,,2023-03-27 10:55:38,"Exactly, isn't it famously pedestrianised / too narrow for cars anyway?",,https://www.reddit.com/r/london/r/london/comments/123bprx/the_daily_mails_exclusive_on_a_15_metre_stretch/jduk485/,,"The Daily Mail's ""exclusive"" on a 15 metre stretch of an Islington side street."
comment,,2023-03-27 12:57:02,"Yeah I've seen the works for this. The primary purpose of the wavyness is probably slowing down cyclists, not cars. There are even rumble strips planned further up.",,https://www.reddit.com/r/london/r/london/comments/123bprx/the_daily_mails_exclusive_on_a_15_metre_stretch/jdusxxh/,,"The Daily Mail's ""exclusive"" on a 15 metre stretch of an Islington side street."
post,How are we liking the new Low Traffic Neighbourhood measures popping up?,2020-08-10 09:55:16,"The LTN around Colebrooke Row has made my bike commute a lot easier, Broadway Market is thriving, and more are on the way, despite some protests. Have you got a new one near you?",72.0,https://www.reddit.com/r/london/r/london/comments/i70o0r/how_are_we_liking_the_new_low_traffic/,low traffic neighbourhood,
comment,,2020-08-10 11:00:21,"They seem great, although have you seen the Islington NextDoor threads; it's insane.

The big irony is that the changes they are making on the Islington side of the ""border"" are pretty much the same as they've had in Hackney for a long time and seem to work well there - literally a few hundred metres down the road. Where Northchurch Road meets De Beauvoir Square is a good example.

Edited as I forgot how to spell &amp; do the grammar",,https://www.reddit.com/r/london/r/london/comments/i70o0r/how_are_we_liking_the_new_low_traffic/g0z6wab/,,How are we liking the new Low Traffic Neighbourhood measures popping up?
comment,,2020-08-10 11:08:13,"Well of course they don't know that; if you drive around Islington, you won't drive near De Beauvoir, because you can't. So you won't know about it, because you'll never have been.",,https://www.reddit.com/r/london/r/london/comments/i70o0r/how_are_we_liking_the_new_low_traffic/g0z7cly/,,How are we liking the new Low Traffic Neighbourhood measures popping up?
comment,,2020-08-10 10:21:34,"I'm really sad that the nimbys in my area got our one stopped. I was really looking forward to the ability to cycle through it.   
  
  Since all the surrounding areas are having them put in place I'm intrigued by the effect on our little island of unrestricted traffic.",,https://www.reddit.com/r/london/r/london/comments/i70o0r/how_are_we_liking_the_new_low_traffic/g0z4p3e/,,How are we liking the new Low Traffic Neighbourhood measures popping up?
post,How do you feel about Low Traffic Neighbourhoods in your borough?,2020-09-09 11:47:44,"So LTN's are popping up around London. 

The point is that they are supposed to reduce the dominance of cars in residential areas and allow journeys to be more easily made via cycling, walking and public transport. There are many places in London where they have existed for decades but it's argued that GPS, increasing numbers of cars, increasing numbers of cyclists and the need for physical distancing has made it more urgent.

However as a result some car journeys may be longer and there are claims that traffic and pollution is made worse on main roads - where people also live.

There is also large scale opposition from many black taxi drivers who are accustomed to using back streets to avoid traffic which may no longer be possible.

What's your view and it would be good to know how you travel around London?

[View Poll](https://www.reddit.com/poll/ipcxiq)",60.0,https://www.reddit.com/r/london/r/london/comments/ipcxiq/how_do_you_feel_about_low_traffic_neighbourhoods/,low traffic neighbourhood,
comment,,2020-09-09 15:23:07,It's the people who moan about their journey distance doubling from 1.5 miles to 3 miles that make me laugh.  Maybe you shouldn't be driving 1.5 miles in the first place?,,https://www.reddit.com/r/london/r/london/comments/ipcxiq/how_do_you_feel_about_low_traffic_neighbourhoods/g4jl3r2/,,How do you feel about Low Traffic Neighbourhoods in your borough?
comment,,2020-09-09 23:01:48,"Exactly, I generally hear “my 10 minute journey now takes 40” ... yeah that’s the point, you shouldn’t be driving the 10 minute journey!",,https://www.reddit.com/r/london/r/london/comments/ipcxiq/how_do_you_feel_about_low_traffic_neighbourhoods/g4l3gcn/,,How do you feel about Low Traffic Neighbourhoods in your borough?
comment,,2020-09-11 19:58:19,"Except unless you're a tradesperson transporting 15 sheets of ply weighing 20kg each to the newly moved into to the area merchant banker who lives in a 6 bedroom mini mansion alone.

Or if you're a delivery driver struggling to keep up with the increased online shopping demand or make it around the corner to drop stock to the local shops.

Or if you're disabled/have lack of mobility and are no longer able to make essential hospital appointments and visit family members.",,https://www.reddit.com/r/london/r/london/comments/ipcxiq/how_do_you_feel_about_low_traffic_neighbourhoods/g4uh0eb/,,How do you feel about Low Traffic Neighbourhoods in your borough?
comment,,2020-09-13 20:32:35,"If you're aiming to improve air quality and the environment which is the guise under which these closures are implemented then no.

Mr/Mrs banker is still wasting energy heating up a home far bigger than they need and the tradesperson is still idling for far longer before whilst waiting in traffic.",,https://www.reddit.com/r/london/r/london/comments/ipcxiq/how_do_you_feel_about_low_traffic_neighbourhoods/g555juk/,,How do you feel about Low Traffic Neighbourhoods in your borough?
post,Low Traffic Neighbourhood trials suspended - Wandsworth,2020-09-11 18:39:31,"Wandsworth Council is to suspend its Low Traffic Neighbourhood (LTN) trials following a high level review.

The LTN trials were introduced last month to make residential streets more bike and pedestrian friendly and to deter rat run traffic.  


They were part of a series of measures introduced as part of the COVID response by freeing up additional space on the highway in support of social distancing and to promote alternative forms of travel as people gradually return to work.

The trials also supported the council’s ambition of combating climate change by encouraging people to use more sustainable forms of transport and tackling air quality.

However an initial review of the trials has identified concerns with emergency access and traffic flows. And this has been compounded by additional changes that Transport for London (TfL) is making to red route roads in the borough.  


These include significant interventions on the A24 (Balham High Road to Tooting High Street and beyond) including moving bus stops, installing cycle lane segregation, banning turns at a number of junctions and removing parking.

The scale of these A24 changes coinciding with the council’s efforts to establish LTNs on residential streets has caused confusion and long traffic queues.

Additionally, concerns around rising COVID rates and reduced capacity on public transport has meant that alternative travel options are limited for many people at this time.

In light of these initial trial findings the council has decided to suspend the LTN trials.

Wandsworth Council’s cabinet member for strategic planning and transportation, Cllr John Locker said: “We have monitored the traffic flows and listened to feedback from residents and businesses. We have also spoken to our partners including local hospitals and key services to hear the impact on them.

“It is clear that the LTNs are not delivering the benefits we want to see. In fact it looks like the combination of changes in areas like Tooting, where TfL are making changes to the main high road, are unfortunately having the opposite effect. That is why we have taken the difficult decision to pause and re-think about how we can achieve our objective of delivering healthier, safer streets.”

He added: “We all want to do what is right environmentally, whilst maintaining people’s ability to travel and making sure town centres and high streets function properly. It’s important that we listen to what people are saying so that we get this right.”

The Council will continue to review the impact of TfL’s road changes to the A24 in Balham and Tooting to see if the issues improve over the coming weeks.

source:  [https://www.wandsworth.gov.uk/news/september-2020/low-traffic-neighbourhood-trials-suspended/](https://www.wandsworth.gov.uk/news/september-2020/low-traffic-neighbourhood-trials-suspended/)",41.0,https://www.reddit.com/r/london/r/london/comments/iqu2yg/low_traffic_neighbourhood_trials_suspended/,low traffic neighbourhood,
comment,,2020-09-11 21:33:44,"Sounds like they did a shit job of implementing it and when it caused problems, instead of tweaking or letting the changes bed in, they just ditched it completely. I guess they never really wanted to do it, but felt like they had to look like they were doing something.",,https://www.reddit.com/r/london/r/london/comments/iqu2yg/low_traffic_neighbourhood_trials_suspended/g4utcig/,,Low Traffic Neighbourhood trials suspended - Wandsworth
comment,,2020-09-12 00:56:07,"This is Wandsworth council after all, wouldn’t surprise me if that was deliberate as they were probably required to implement it and now they can go “well, we tried” 🤷‍♂️",,https://www.reddit.com/r/london/r/london/comments/iqu2yg/low_traffic_neighbourhood_trials_suspended/g4vja0n/,,Low Traffic Neighbourhood trials suspended - Wandsworth
comment,,2020-09-12 01:36:20,100% this. It’s been a shit show. I’ve never felt safer walking and cycling around here. The way people are reacting to the news you’d be forgiven for thinking there’s no pandemic or climate emergency.,,https://www.reddit.com/r/london/r/london/comments/iqu2yg/low_traffic_neighbourhood_trials_suspended/g4vnf0o/,,Low Traffic Neighbourhood trials suspended - Wandsworth
