type,title,created_utc,body,num_comments,url,keyword_matched,parent_post_title
comment,,2020-09-12 09:05:10,"Probably doesn't help that consultations are constantly spammed by ""but muh human right to drive"" types and driver advocacy and black cab groups.

People are dying due to toxic air in this city, cars take up huge amounts of space and make vast swathes of  London unpleasant to be in, and in most cases are a matter of convenience rather than necessity (the stat that 35% of car journeys are under 2km is especially shocking) - you'd think councils might ignore these dinosaurs and wait for these LTNs to take effect and the gradual shift from cars to public transport and cycling/walking to actually begin before throwing in the towel.",,https://www.reddit.com/r/london/r/london/comments/iqu2yg/low_traffic_neighbourhood_trials_suspended/g4wqupa/,,Low Traffic Neighbourhood trials suspended - Wandsworth
comment,,2020-09-12 10:53:03,"It's easy to get consultation responses from noisy minorities. Motorists and cyclists can sometimes indentify very strongly with their mode of transport. Pedestrians? Not so much. Children who can't safely walk to school, who can't play in their street, are they going to up and form a local campaigning organisation to represent their interests? Of course not. But they are hugely affected by the dominance of motor traffic.

I do think that it's up to councils to weather any initial angry response and show leadership - particularly if they were elected on manifestos which stated they would encourage walking and cycling. They shouldn't judge the response by how busy their inbox is now, but by how busy it is once everyone has got used to the changes. I bet councillors in Hackney never get emails asking them to rip out bollards put in place back in the 70s, put it that way...

edit - re the mention of manifestos, [this snippet](https://twitter.com/Jo_Earlsfield/status/1304699461046882304) from the Wandsworth Tories' election material in 2018 is interesting. Sounds like they were empty promises.",,https://www.reddit.com/r/london/r/london/comments/iqu2yg/low_traffic_neighbourhood_trials_suspended/g4wwzfw/,,Low Traffic Neighbourhood trials suspended - Wandsworth
post,Low Traffic Neighbourhood in Lewisham not exactly working as intended...,2020-06-30 17:09:14,,42.0,https://www.reddit.com/r/london/r/london/comments/hip4mw/low_traffic_neighbourhood_in_lewisham_not_exactly/,low traffic neighbourhood,
comment,,2020-06-30 22:31:35,"99% chance some aggo builder or drug-dealing clapped-out Mercedes driver would confront you about ""blockin'' the bleedin' road!""",,https://www.reddit.com/r/london/r/london/comments/hip4mw/low_traffic_neighbourhood_in_lewisham_not_exactly/fwihg09/,,Low Traffic Neighbourhood in Lewisham not exactly working as intended...
comment,,2020-06-30 22:11:18,"Upwood road

All of the people on the Facebook group are losing their shit. Some justifying it. In general the people who have cars have opposed this since the start, but theyre the ones clogging up the road and creating pollution by driving a car for short journeys. 

There are also the Karen’s that keep claiming not everyone is able to walk due to disabilities, but I suspect most of them are obese and probably could do with the exercise.",,https://www.reddit.com/r/london/r/london/comments/hip4mw/low_traffic_neighbourhood_in_lewisham_not_exactly/fwieu8m/,,Low Traffic Neighbourhood in Lewisham not exactly working as intended...
comment,,2020-06-30 22:53:07,"&gt; In general the people who have cars have opposed this since the start

It was the same in Wapping when the bus gate got started, locals demanding exemption because they didn't want a 5 minute detour, in a car. 

Not comprehending they were literally the problem.",,https://www.reddit.com/r/london/r/london/comments/hip4mw/low_traffic_neighbourhood_in_lewisham_not_exactly/fwik8qq/,,Low Traffic Neighbourhood in Lewisham not exactly working as intended...
post,"Fixing vandalised LTN infrastructure costs London councils more than £850,000 | Low-traffic neighbourhoods",2023-08-16 18:00:47,,7.0,https://www.reddit.com/r/london/r/london/comments/15stv97/fixing_vandalised_ltn_infrastructure_costs_london/,low traffic neighbourhood,
comment,,2023-08-16 18:05:59,"The same people vandalising, Are the same people compaining that their local councils arent investing into the local area.",,https://www.reddit.com/r/london/r/london/comments/15stv97/fixing_vandalised_ltn_infrastructure_costs_london/jwg46pm/,,"Fixing vandalised LTN infrastructure costs London councils more than £850,000 | Low-traffic neighbourhoods"
comment,,2023-08-16 19:06:25,"This scheme is a waste of money. But the objective is the right one.

The way it's been implemented is a disaster. All they needed to do was make the roads a dead end either at one end or in the middle of the road and it would have the same effect in reducing all through traffic which is the problem. There are thousands of these all around london for years that work absolutely fine.

You wouldn't get people getting fined because it's impossible to read the fucking signs, and residents can still access the road and a few local people could still go and park on the road if they needed to, or you know visit a friend who lives on the road, or pick their nan up in their car to take her to the shops, and you could still put your benches and stuff up. 

And you wouldn't even get anti green car users protesting ""green zones"". it would just be another dead end road, end of story.

So you'll get the same result with non of the cost or problems.",,https://www.reddit.com/r/london/r/london/comments/15stv97/fixing_vandalised_ltn_infrastructure_costs_london/jwgedox/,,"Fixing vandalised LTN infrastructure costs London councils more than £850,000 | Low-traffic neighbourhoods"
comment,,2023-08-16 21:01:08,That is because displacing traffic is not an investment,,https://www.reddit.com/r/london/r/london/comments/15stv97/fixing_vandalised_ltn_infrastructure_costs_london/jwgxuje/,,"Fixing vandalised LTN infrastructure costs London councils more than £850,000 | Low-traffic neighbourhoods"
post,"Low traffic neighbourhoods popular with London voters, analysis finds",2021-06-02 13:49:10,,17.0,https://www.reddit.com/r/london/r/london/comments/nqjz0s/low_traffic_neighbourhoods_popular_with_london/,low traffic neighbourhood,
comment,,2021-06-03 12:05:02,"I'm an LTN supporter but some of the ""evidence"" in the early part of that article was thin at best.

You can't divine from ward voting patterns of Con v Lab whether people supported an LTN or not. That's ridiculous given what is going on in national politics and the fact that both Shaun Bailey and Sadiq Khan are, in their own ways, divisive candidates. Even in somewhere where LTNs were a big issue like Ealing and where even some Labour politicians like Rupa Huq came out as anti LTN.

About the best one can conclude is that they aren't a major vote loser.

Once it became clear that Shaun Bailey would lose it was a slam dunk on for Labour pro-cycling types to treat the elections as a referendum on LTNs. Arguably, for a candidate as poor as Bailey, his improved showing in polls, which was higher than predicted, could equally be attributed to his anti-LTN stance.

There are much better arguments to be made for the popularity of LTNs, including evidence from Walthamstow and the fact that nobody is militating to remove the thousands of LTNs that already exist.",,https://www.reddit.com/r/london/r/london/comments/nqjz0s/low_traffic_neighbourhoods_popular_with_london/h0f711j/,,"Low traffic neighbourhoods popular with London voters, analysis finds"
comment,,2021-06-02 14:23:07,"Reminder that the founder of one of the anti LTN groups stood for local election on the promise of removing them, and came last.",,https://www.reddit.com/r/london/r/london/comments/nqjz0s/low_traffic_neighbourhoods_popular_with_london/h0b0io1/,,"Low traffic neighbourhoods popular with London voters, analysis finds"
comment,,2021-06-02 22:40:36,"I found them annoying where i live near Crystal Palace, mostly because of how it personally affected me.  I had the impression that people in the area felt the same and there were plenty of anti signs in windows of houses.

It did seem that the nicer streets with bigger houses near the parks benefitted and that the traffic was diverted to the rest of us.  I'm glad they took them away but didn't feel strongly enough to be vocal about it.",,https://www.reddit.com/r/london/r/london/comments/nqjz0s/low_traffic_neighbourhoods_popular_with_london/h0cx67n/,,"Low traffic neighbourhoods popular with London voters, analysis finds"
post,Hackney low traffic neighbourhoods have not caused a rise in traffic on nearby main roads,2020-11-24 17:36:04,,17.0,https://www.reddit.com/r/london/r/london/comments/k08d5c/hackney_low_traffic_neighbourhoods_have_not/,low traffic neighbourhood,
comment,,2020-11-25 12:39:58,Absolutely. The A107 from Upper Clapton to Kenworthy Road in Homerton is shocking. The entire neighbourhoods traffic has been hearded into to a single lane on a single road. Its just complete gridlock for hours.,,https://www.reddit.com/r/london/r/london/comments/k08d5c/hackney_low_traffic_neighbourhoods_have_not/gdjnc1d/,,Hackney low traffic neighbourhoods have not caused a rise in traffic on nearby main roads
comment,,2020-11-24 19:41:20,"Traffic has been *higher*, as people get off public transport and sit by themselves in cars. One bus carries seventy odd people. 40 of those people have decided to drive instead of getting the bus, 20 of those travel alone in a car. End result: one bus + 30 odd cars.

Traffic is at pre-lockdown levels, despite the increased number of people WFH.",,https://www.reddit.com/r/london/r/london/comments/k08d5c/hackney_low_traffic_neighbourhoods_have_not/gdgxlwp/,,Hackney low traffic neighbourhoods have not caused a rise in traffic on nearby main roads
comment,,2020-11-24 19:48:31,"That’s the opposite of what I have read https://www.theguardian.com/uk-news/2020/apr/03/uk-road-travel-falls-to-1955-levels-as-covid-19-lockdown-takes-hold-coronavirus-traffic 

The article doesn’t link out to any study or figures so it’s hard to gauge whether they have taken into account the exceptional nature of this year in comparison to 2019 or whether they have just made a side-by-side comparison (which could be disingenuous)",,https://www.reddit.com/r/london/r/london/comments/k08d5c/hackney_low_traffic_neighbourhoods_have_not/gdgyize/,,Hackney low traffic neighbourhoods have not caused a rise in traffic on nearby main roads
post,The war on cars - low traffic neighbourhoods (LTNs),2021-07-26 13:07:00,,17.0,https://www.reddit.com/r/london/r/london/comments/orwi6s/the_war_on_cars_low_traffic_neighbourhoods_ltns/,low traffic neighbourhood,
comment,,2021-07-26 13:32:39,"For someone so vehemently against LTNs because they're 'illogical', her arguments , if you can even call them, are very confusing.  

""LTNs block roads""  

Her evidence for that is a taxi driver complaining about it to her. There's no evidence for that at all. Roads have been busier, but it's due to more drivers as people avoid public transport (as shown [in Sustrans' overview of LTN research](https://www.sustrans.org.uk/for-professionals/infrastructure/an-introductory-guide-to-low-traffic-neighbourhood-design/an-introductory-guide-to-low-traffic-neighbourhood-design-contents/design-guide/all/5-a-guide-to-the-evidence-around-low-traffic-neighbourhoods).  

""They prevent injuries, but that's not important as it's obvious"" 

I really don't understand that argument. Is it even an argument?  

""They generate too many fines""  

Good. People should pay attention to road signs. Whether that's LTN signs or 20mph speed limits or whatever else.  

""It's bad because the Conservatives are now investing money in active travel""  

Another one I really don't understand.  

""It's emblematic of an era of environmentalism""  

I'm also very happy about this. I very much enjoy breathing less polluted air.",,https://www.reddit.com/r/london/r/london/comments/orwi6s/the_war_on_cars_low_traffic_neighbourhoods_ltns/h6kqhcg/,,The war on cars - low traffic neighbourhoods (LTNs)
comment,,2021-07-26 18:55:16,"&gt; The next time I discovered LTNs was when I ordered a taxi – approximately 500 metres away – and it took 20 minutes to arrive. “Where are you?” I said, rather urgently, on the phone to the driver. “Sorry, it’s these LTNs”, he replied. 

Haha, what a chancer",,https://www.reddit.com/r/london/r/london/comments/orwi6s/the_war_on_cars_low_traffic_neighbourhoods_ltns/h6lsmpt/,,The war on cars - low traffic neighbourhoods (LTNs)
post,Cycling in a Low Traffic Neighbourhood,2021-06-27 11:56:50,,13.0,https://www.reddit.com/r/london/r/london/comments/o8u577/cycling_in_a_low_traffic_neighbourhood/,low traffic neighbourhood,
comment,,2021-06-27 13:35:57,hope these expand. I lived in Ealing until recently and many local people were super reactionary about the introduction of LTNs. (to be fair the council did a horrible job of consulting and preparing people for them),,https://www.reddit.com/r/london/r/london/comments/o8u577/cycling_in_a_low_traffic_neighbourhood/h37awpy/,,Cycling in a Low Traffic Neighbourhood
comment,,2021-06-27 13:46:57,"It's funny how LTNs are getting blamed for congestion, when the places that had LTNs and took them out (Ealing, Wandsworth) have it even worse if anything.

People are still avoiding public transport, so traffic is higher than it was pre-pandemic. I hope this changes soon, the risk doesn't seem very high what with how many people are vaccinated and mask wearing still being mandatory. Plus TfL badly needs the money from fares of course.

The consultations for the most part were hampered by the need to move quickly. These schemes were all supposed to enable people to walk and cycle more as lockdown lifted, instead of getting in their cars. I won't deny that corners were cut, but it was for a good reason, an act of parliament was passed to relax the usual consultation requirements.",,https://www.reddit.com/r/london/r/london/comments/o8u577/cycling_in_a_low_traffic_neighbourhood/h37bp1s/,,Cycling in a Low Traffic Neighbourhood
comment,,2021-06-27 15:14:27,"Ealing have only taken out one LTN - that was mainly because Hounslow half closed a road which diverted a huge amount of traffic to the area the LTN was also sending traffic to. Something had to give, it was that Ealing LTN.    
      
Ealing's other LTNs are still in place but will be subject to consultation soon.",,https://www.reddit.com/r/london/r/london/comments/o8u577/cycling_in_a_low_traffic_neighbourhood/h37iwc8/,,Cycling in a Low Traffic Neighbourhood
post,Opinions on LTNS?,2023-01-30 15:26:06,"Low Traffic Neighbourhoods have not gone down well in Haringey. It’s the topic on the streets all over and seems to be new(ish)-to-london are the only ones who support it. 

Gentrification? Money making scheme?
Has it made you walk/cycle/use public transport more? 


Thoughts?",554.0,https://www.reddit.com/r/london/r/london/comments/10p3wex/opinions_on_ltns/,low traffic neighbourhood,
comment,,2023-01-30 15:33:03,"Some people are unhappy about them, yes, and they are very vocal about it. But given that only 40% of Haringey residents even have a car, I doubt it's a majority who oppose LTNs",,https://www.reddit.com/r/london/r/london/comments/10p3wex/opinions_on_ltns/j6i4uaz/,,Opinions on LTNS?
comment,,2023-01-30 16:19:11,"40% of \*households\*. So even fewer residents.

Children, for example, definitely don't own cars but do use the streets.",,https://www.reddit.com/r/london/r/london/comments/10p3wex/opinions_on_ltns/j6ibb39/,,Opinions on LTNS?
comment,,2023-01-31 12:31:11,"From what I've seen, the majority of those making the most noise don't live in the Borough itself and live inside historic LTN's themselves.

Their campaign headquarters are nearly all based in historic LTN's....",,https://www.reddit.com/r/london/r/london/comments/10p3wex/opinions_on_ltns/j6mifvr/,,Opinions on LTNS?
post,Road closed or open? The signs revamping low-traffic neighbourhoods,2020-09-14 01:23:08,,2.0,https://www.reddit.com/r/london/r/london/comments/is96is/road_closed_or_open_the_signs_revamping/,low traffic neighbourhood,
comment,,2020-09-15 21:50:00,"Terrible idea. As a driver I want to see nice and clear if I can't go down a road, not peer at a list of what *is* allowed to see if there's a car on it.

Keep in mind people are driving - they have two seconds to scan for signs, which can be anywhere, while moving and trying not to hit anything.

And get it wrong and now your'e stuck in the wrong place trying to reverse across a junction while pedestrians wander around and other drivers cut you up.",,https://www.reddit.com/r/london/r/london/comments/is96is/road_closed_or_open_the_signs_revamping/g5e74s5/,,Road closed or open? The signs revamping low-traffic neighbourhoods
comment,,2020-09-14 09:03:07,"All very nice, but round here (fg/leyton) they’ve had to give up and install posts in lot of places because people just ignored the signs, no matter what colour.",,https://www.reddit.com/r/london/r/london/comments/is96is/road_closed_or_open_the_signs_revamping/g57k5my/,,Road closed or open? The signs revamping low-traffic neighbourhoods
comment,,2023-04-21 16:06:15,"Looks great!  


I hope hackney follows suit with some more permanent installs - planter boxes are great but they are often ignored..",,https://www.reddit.com/r/london/r/london/comments/12u26gh/remember_the_outrage_at_islington_council_for/jh59az3/,,Remember the OUTRAGE at Islington council for destroying Charlton Place? This is it today.
comment,,2023-04-21 18:06:38,It is important to make permanent changes so that morons can't easily reverse it.,,https://www.reddit.com/r/london/r/london/comments/12u26gh/remember_the_outrage_at_islington_council_for/jh5r15x/,,Remember the OUTRAGE at Islington council for destroying Charlton Place? This is it today.
comment,,2023-04-21 20:43:42,*Tower Hamlets leaves the chat*,,https://www.reddit.com/r/london/r/london/comments/12u26gh/remember_the_outrage_at_islington_council_for/jh6emt5/,,Remember the OUTRAGE at Islington council for destroying Charlton Place? This is it today.
comment,,2023-04-22 00:06:41,:'(,,https://www.reddit.com/r/london/r/london/comments/12u26gh/remember_the_outrage_at_islington_council_for/jh77y3l/,,Remember the OUTRAGE at Islington council for destroying Charlton Place? This is it today.
comment,,2024-09-26 11:15:17,"Why? London already has Heathrow &amp; Gatwick which are very well connected via public transport, and slightly less conveniently, Stansted, Luton and Southend. 

LCY is already subject to curfews and has a smaller runway, so can't service as many flights. 

Closing LCY would mainly inconvenience bankers who need to get from Canary Wharf to Lucerne in as few minutes as possible, without having to brush shoulders with the unwashed oiks at the other airports. 

It should come as no surprise to anyone that there's a housing crisis. Closing the airport would not only free up the land it's on for housing, but also unlock more housing in the surrounding area as it'd no longer be blighted by the atmospheric and noise pollution from the airport.",,https://www.reddit.com/r/london/r/london/comments/1fprmjj/what_are_our_councillors_doing_feat_lewisham/lozrqdr/,,What are our councillors doing? (feat Lewisham!)
comment,,2024-09-26 11:40:54,"My point was more that the council should absolutely not have power to decide this. Airports are nationally important, and if you gave the choice to residents, none would get built. See also trains and reservoirs for more. 

The UK lags so far behind other countries and so much of it is because of fucking planning law and old people/nimbys on local councils blocking anyone who wants to do anything.",,https://www.reddit.com/r/london/r/london/comments/1fprmjj/what_are_our_councillors_doing_feat_lewisham/loztxcy/,,What are our councillors doing? (feat Lewisham!)
comment,,2024-09-26 12:16:49,"&gt; The UK lags so far behind other countries and so much of it is because of fucking planning law and old people/nimbys on local councils blocking anyone who wants to do anything

kinda strange argument to make when you're arguing against development",,https://www.reddit.com/r/london/r/london/comments/1fprmjj/what_are_our_councillors_doing_feat_lewisham/lozx8lx/,,What are our councillors doing? (feat Lewisham!)
comment,,2025-05-15 12:49:20,Barnet council actually approved the expansion years ago but Sadiq Khan overturned the decision.,,https://www.reddit.com/r/london/r/london/comments/1klicoz/what_are_our_councils_doing/msfe5cc/,,What are our councils doing?
comment,,2021-07-19 00:39:51,"People are already queuing around the block to go to Heaven.

Ah",,https://www.reddit.com/r/london/r/london/comments/omvz1e/its_freedom_day_tomorrow/h5opgeg/,,It's Freedom Day tomorrow
post,How should we make alternative modes to cars better?,2022-03-29 08:44:50,"Driving in London can often be the best choice for a trip, but half of households don’t own a car and if they did traffic would be even worse. Of course, alternatives are less congestion/polluting/noisy/dangerous… So

How should we as a city enable people to drive when they need to whilst making sure alternatives are typically a better option. Driving can make busses unreliable, cycling unsafe, and walking unpleasant, so something has to give to make these appealing.

Currently we have:

• ULEZ and congestion charge

•LTNs - Low traffic neighbourhoods where you can only drive for access

• Pedestrianised areas

• Cycle and Bus lanes

So what would you do? What would you change to alleviate traffic whilst still letting people drive when they need to?",88.0,https://www.reddit.com/r/london/r/london/comments/tqtq37/how_should_we_make_alternative_modes_to_cars/,low traffic neighbourhood,
post,When is the Met actually going to do something about reckless moped drivers?,2022-08-11 20:54:57,"Walking home almost got hit by two mopeds. One was going straight through a zebra crossing whilst I crossed. And the other drove down the pavement, shooing me out the way to avoid a low traffic neighbourhood block. 

All of course were clearly ""Learner"" delivery guys on loud mopeds. 

When are the Met actually going to do something about these reckless delivery mopeds??",37.0,https://www.reddit.com/r/london/r/london/comments/wlz567/when_is_the_met_actually_going_to_do_something/,low traffic neighbourhood,
comment,,2022-08-12 09:25:46,I reported one recently and got email back saying they intend to prosecute...,,https://www.reddit.com/r/london/r/london/comments/wlz567/when_is_the_met_actually_going_to_do_something/ijytbwa/,,When is the Met actually going to do something about reckless moped drivers?
post,This weeks 'What I rent',2020-12-09 14:10:20,"It does look like a stunning flat with nice features but there's a lot going on there!  
[https://metro.co.uk/2020/12/08/what-i-rent-anna-1980-a-month-for-a-three-bedroom-flat-in-crystal-palace-london-13716932/](https://metro.co.uk/2020/12/08/what-i-rent-anna-1980-a-month-for-a-three-bedroom-flat-in-crystal-palace-london-13716932/)",35.0,https://www.reddit.com/r/london/r/london/comments/k9rkc0/this_weeks_what_i_rent/,low traffic neighbourhood,
comment,,2020-12-10 15:27:08,"https://www.reddit.com/r/london/comments/eojkmr/what_i_rent_adam_1690_a_month_for_a_studio_flat/

Here's the thread!",,https://www.reddit.com/r/london/r/london/comments/k9rkc0/this_weeks_what_i_rent/gfa3shj/,,This weeks 'What I rent'
comment,,2022-06-01 17:52:45,"check the new post, it details the ridiculously large amount of routes being removed, altered, or added",,https://www.reddit.com/r/london/r/london/comments/v2j2qf/central_london_buses_could_be_reduced_by_fifth/iasrwf4/,,"Central London buses could be reduced by fifth, TfL warns"
comment,,2022-06-01 17:55:41,I’m aware. Public transport is cut; private transport is encouraged. It’s bullshit.,,https://www.reddit.com/r/london/r/london/comments/v2j2qf/central_london_buses_could_be_reduced_by_fifth/iassbc9/,,"Central London buses could be reduced by fifth, TfL warns"
comment,,2022-06-01 20:17:33,"Since it’s still a TfL consultation, I hope more people can respond to it, and let our voice be heard - even if chances might be slim, hopefully something can be done to mitigate this. I myself am still thinking of what sort of response to write in the comments box.",,https://www.reddit.com/r/london/r/london/comments/v2j2qf/central_london_buses_could_be_reduced_by_fifth/iatcq5k/,,"Central London buses could be reduced by fifth, TfL warns"
comment,,2022-08-11 00:16:52,"?

It’s anti-LTN nonsense.  Some people care a lot by themselves but there’s also a concerted campaign from the usual right wing suspects to turn it into a culture war thing.",,https://www.reddit.com/r/london/r/london/comments/wkuvxn/what_is_going_on/ijs36nz/,,What is going on?
comment,,2022-08-12 14:09:24,"It's a protest against low traffic neighbourhoods. I wouldn't describe them as nonsense as others do because your views on them will very much be coloured by their local implementation and your postcode.

We have quite a few in our area but not down our road and since they implemented them we are now taking all the traffic that would have previously spread across multiple roads, as a result its difficult to cross the road at times. It doesn't appear to have reduced traffic just displaced it. 

We're campaigning locally to try and extend the scheme but apparently our local ward councillor is against it (hence us being excluded in the first place) and it's starting to feel like it would be easier to campaign against the whole thing.",,https://www.reddit.com/r/london/r/london/comments/wkuvxn/what_is_going_on/ijzgrjl/,,What is going on?
